{
  "$schema": "schema/assessment-capability-manifest-v0.1.schema.json",
  "component_rights_policy": {
    "native_component_exceptions": 18,
    "state": "preserved_in_sealed_A00_native_rights_shard_not_flattened"
  },
  "counts": {
    "assessment_components": 13345,
    "assessments": 8105,
    "exact_html_anchor_routes": 21450,
    "modules": 75,
    "solution_components": 5240,
    "solution_gaps": 2865,
    "statement_components": 8105
  },
  "course_id": "urn:uuid:8d8ea368-373c-54d7-a6d3-4d9cfdaf46fe",
  "dataset_id": "urn:uuid:2afd6e58-418c-5b1b-b690-53f4ec9bffdf",
  "edition_id": "urn:uuid:45f9ea49-dc03-5d1f-b872-70ca241e20a7",
  "identity_sets": {
    "assessment_components": "104253fcfdbdb0b8449b4fd212d0c6c54ab7cc6651d85b21fe1e36d8fc74ccaf",
    "assessments": "c25e6f13e9a7d1b6b0b46815b280ab09fdd8e15db772eed6055ddeff6ee4cf4c",
    "combined": "990cf0ffbb5e4ce67fd12ac4bba6111745fa193e026a2b3d8a05162bc48c3240",
    "solution_gaps": "353db3d096043accf6cb51618350a659697f81e6ab2b5f49d9d6b6446b599df5"
  },
  "loss_accounting": {
    "explicit_no_solution_gaps": 2865,
    "invented_solutions": 0,
    "missing_anchors": 0,
    "unmapped_assessments": 0,
    "unmapped_components": 0
  },
  "module_unit_mapping_sha256": "dca9b8dfe1aad797315d6c7186665eedcdcd045bde8514ad91448b3484342dfe",
  "owner_authority_id": "urn:uuid:09dffe8a-788a-538b-8784-88c509191790",
  "package_id": "urn:uuid:ae5acc9e-aa8a-5905-b6e2-65e928858b35",
  "pattern_audit_combined_shards_sha256": "ee21807297f7ac0b04c00ccbf7b3c1eae5ba9ff7bc48f20d0f236b389f259455",
  "recorded_at": "2026-08-31T00:00:00Z",
  "rights_id": "urn:uuid:b1990d86-8885-5632-8f20-0955a382d53f",
  "route_policy": {
    "anchor_evidence": "exactly_one_local_HTML_id_attribute_per_assessment_or_component",
    "destination": "existing_A00_readable_semantic_HTML",
    "fragment_source": "owner_native_id",
    "network_state": "module_publication_state_inherited_from_sealed_A00_package_no_refetch"
  },
  "schema_id": "interlanguage/a00-o001-assessment-capability/0.1.0",
  "schema_version": "0.1.0",
  "shards": [
    {
      "bytes": 17421146,
      "format": "canonical_jsonl",
      "path": "assessment-bindings-v0.1.0.jsonl",
      "path_base": "package_root",
      "record_id_set_sha256": "c25e6f13e9a7d1b6b0b46815b280ab09fdd8e15db772eed6055ddeff6ee4cf4c",
      "records": 8105,
      "role": "assessment_binding_table",
      "sha256": "f6d52a0bff1b7e20b1fa8926211b43ee7a514e1e4a99aaf32b7987668f5f734d"
    },
    {
      "bytes": 19293445,
      "format": "deterministic_csv",
      "path": "assessment-csv/assessment-bindings.csv",
      "path_base": "package_root",
      "record_id_set_sha256": "c25e6f13e9a7d1b6b0b46815b280ab09fdd8e15db772eed6055ddeff6ee4cf4c",
      "records": 8105,
      "role": "assessment_binding_csv",
      "sha256": "64297ef2528bff0ffa87204cadec1a2b76c820f0463a18c0105d16cde741d48a"
    },
    {
      "bytes": 26942732,
      "format": "canonical_jsonl",
      "path": "assessment-component-bindings-v0.1.0.jsonl",
      "path_base": "package_root",
      "record_id_set_sha256": "104253fcfdbdb0b8449b4fd212d0c6c54ab7cc6651d85b21fe1e36d8fc74ccaf",
      "records": 13345,
      "role": "assessment_component_binding_table",
      "sha256": "97b9a482a4b79a845a58d9ed4e8e8a7e69027bad81e9df87646119d4bbc74bc4"
    },
    {
      "bytes": 30052161,
      "format": "deterministic_csv",
      "path": "assessment-csv/assessment-component-bindings.csv",
      "path_base": "package_root",
      "record_id_set_sha256": "104253fcfdbdb0b8449b4fd212d0c6c54ab7cc6651d85b21fe1e36d8fc74ccaf",
      "records": 13345,
      "role": "assessment_component_binding_csv",
      "sha256": "d10821f02a0eee40dd6d8fe19b67b955963da2cede960680008a940846feea6e"
    },
    {
      "bytes": 4867377,
      "format": "canonical_jsonl",
      "path": "solution-gaps-v0.1.0.jsonl",
      "path_base": "package_root",
      "record_id_set_sha256": "353db3d096043accf6cb51618350a659697f81e6ab2b5f49d9d6b6446b599df5",
      "records": 2865,
      "role": "solution_gap_binding_table",
      "sha256": "f7c8da5f921777f9d7778c32f39160ec8d2d526f92065127c4df47e9665d3211"
    },
    {
      "bytes": 5414636,
      "format": "deterministic_csv",
      "path": "assessment-csv/solution-gaps.csv",
      "path_base": "package_root",
      "record_id_set_sha256": "353db3d096043accf6cb51618350a659697f81e6ab2b5f49d9d6b6446b599df5",
      "records": 2865,
      "role": "solution_gap_binding_csv",
      "sha256": "654c79301dd7cf3b08ba4b9fdc42479256402e1318dc5941cddd8c8eb2a38c71"
    }
  ],
  "source_package_id": "urn:uuid:0b253fa5-067e-55b5-8248-cc528b0b4bd1",
  "zero_copy_policy": {
    "formula_bodies_copied": false,
    "mathematical_prose_copied": false,
    "navigation_units_promoted": false,
    "owner_native_ids_preserved": true
  }
}
